{
  "v": 2,
  "id": "c-14",
  "title": {
    "ru": "Обход",
    "en": "The detour"
  },
  "world": 2,
  "rows": 5,
  "cols": 5,
  "targets": [[2, 4]],
  "fences": [
    [
      [2, 1],
      [3, 1]
    ],
    [
      [2, 2],
      [3, 2]
    ],
    [
      [2, 3],
      [3, 3]
    ],
    [
      [2, 4],
      [3, 4]
    ]
  ],
  "probeMode": "distance",
  "moveLimit": 5,
  "stars": [3, 3]
}
