{
  "v": 2,
  "id": "c-20",
  "title": {
    "ru": "Свет за стеной",
    "en": "Light past the wall"
  },
  "world": 2,
  "rows": 6,
  "cols": 6,
  "targets": [[4, 3]],
  "fences": [
    [
      [2, 0],
      [3, 0]
    ],
    [
      [2, 1],
      [3, 1]
    ],
    [
      [2, 2],
      [3, 2]
    ],
    [
      [2, 3],
      [3, 3]
    ],
    [
      [2, 4],
      [3, 4]
    ]
  ],
  "beacons": [[5, 0]],
  "probeMode": "distance",
  "moveLimit": 4,
  "stars": [2, 3]
}
