{
  "v": 2,
  "id": "c-15",
  "title": {
    "ru": "Два забора",
    "en": "Two fences"
  },
  "world": 2,
  "rows": 6,
  "cols": 6,
  "targets": [[4, 1]],
  "fences": [
    [
      [0, 2],
      [0, 3]
    ],
    [
      [1, 2],
      [1, 3]
    ],
    [
      [2, 2],
      [2, 3]
    ],
    [
      [3, 2],
      [3, 3]
    ],
    [
      [4, 2],
      [4, 3]
    ],
    [
      [3, 4],
      [4, 4]
    ],
    [
      [3, 5],
      [4, 5]
    ]
  ],
  "probeMode": "distance",
  "moveLimit": 5,
  "stars": [3, 4]
}
