{
  "v": 2,
  "id": "c-13",
  "title": {
    "ru": "Первый забор",
    "en": "First fence"
  },
  "world": 2,
  "rows": 5,
  "cols": 5,
  "targets": [[2, 3]],
  "fences": [
    [
      [0, 1],
      [0, 2]
    ],
    [
      [1, 1],
      [1, 2]
    ],
    [
      [2, 1],
      [2, 2]
    ],
    [
      [3, 1],
      [3, 2]
    ]
  ],
  "probeMode": "distance",
  "introduces": "fence",
  "moveLimit": 6,
  "stars": [3, 4]
}
