{
  "v": 2,
  "id": "c-21",
  "title": {
    "ru": "Лабиринт маяков",
    "en": "Beacon maze"
  },
  "world": 2,
  "rows": 6,
  "cols": 6,
  "targets": [[2, 4]],
  "fences": [
    [
      [1, 2],
      [1, 3]
    ],
    [
      [2, 2],
      [2, 3]
    ],
    [
      [3, 2],
      [3, 3]
    ],
    [
      [4, 2],
      [4, 3]
    ],
    [
      [5, 2],
      [5, 3]
    ],
    [
      [3, 4],
      [4, 4]
    ],
    [
      [3, 5],
      [4, 5]
    ]
  ],
  "beacons": [[5, 5]],
  "probeMode": "distance",
  "moveLimit": 4,
  "stars": [2, 3]
}
