{
  "v": 2,
  "id": "c-22",
  "title": {
    "ru": "Узкий проход",
    "en": "Narrow pass"
  },
  "world": 2,
  "rows": 6,
  "cols": 6,
  "targets": [[4, 4]],
  "fences": [
    [
      [0, 1],
      [0, 2]
    ],
    [
      [1, 1],
      [1, 2]
    ],
    [
      [2, 1],
      [2, 2]
    ],
    [
      [3, 1],
      [3, 2]
    ],
    [
      [4, 1],
      [4, 2]
    ],
    [
      [2, 3],
      [3, 3]
    ],
    [
      [2, 4],
      [3, 4]
    ],
    [
      [2, 5],
      [3, 5]
    ]
  ],
  "probeMode": "distance",
  "moveLimit": 5,
  "stars": [3, 4]
}
