{
  "v": 2,
  "id": "c-23",
  "title": {
    "ru": "Двойной зигзаг",
    "en": "Double zigzag"
  },
  "world": 2,
  "rows": 6,
  "cols": 6,
  "targets": [[2, 2]],
  "fences": [
    [
      [0, 0],
      [0, 1]
    ],
    [
      [1, 0],
      [1, 1]
    ],
    [
      [2, 0],
      [2, 1]
    ],
    [
      [3, 0],
      [3, 1]
    ],
    [
      [4, 0],
      [4, 1]
    ],
    [
      [1, 2],
      [1, 3]
    ],
    [
      [2, 2],
      [2, 3]
    ],
    [
      [3, 2],
      [3, 3]
    ],
    [
      [4, 2],
      [4, 3]
    ],
    [
      [5, 2],
      [5, 3]
    ],
    [
      [0, 4],
      [0, 5]
    ],
    [
      [1, 4],
      [1, 5]
    ],
    [
      [2, 4],
      [2, 5]
    ],
    [
      [3, 4],
      [3, 5]
    ],
    [
      [4, 4],
      [4, 5]
    ]
  ],
  "probeMode": "distance",
  "moveLimit": 4,
  "stars": [3, 3]
}
