{
  "v": 2,
  "id": "c-16",
  "title": {
    "ru": "Коридор",
    "en": "Corridor"
  },
  "world": 2,
  "rows": 6,
  "cols": 6,
  "targets": [[5, 4]],
  "fences": [
    [
      [1, 0],
      [2, 0]
    ],
    [
      [1, 1],
      [2, 1]
    ],
    [
      [1, 2],
      [2, 2]
    ],
    [
      [1, 3],
      [2, 3]
    ],
    [
      [1, 4],
      [2, 4]
    ],
    [
      [3, 3],
      [3, 4]
    ],
    [
      [4, 3],
      [4, 4]
    ],
    [
      [5, 3],
      [5, 4]
    ]
  ],
  "probeMode": "distance",
  "moveLimit": 5,
  "stars": [3, 4]
}
