{
  "v": 2,
  "id": "c-24",
  "title": {
    "ru": "Экзамен рифов",
    "en": "Reef exam"
  },
  "world": 2,
  "rows": 6,
  "cols": 6,
  "targets": [[3, 4]],
  "fences": [
    [
      [0, 2],
      [0, 3]
    ],
    [
      [1, 2],
      [1, 3]
    ],
    [
      [2, 2],
      [2, 3]
    ],
    [
      [3, 2],
      [3, 3]
    ],
    [
      [4, 0],
      [5, 0]
    ],
    [
      [4, 1],
      [5, 1]
    ],
    [
      [4, 2],
      [5, 2]
    ]
  ],
  "beacons": [
    [0, 5],
    [5, 0]
  ],
  "probeMode": "distance",
  "moveLimit": 3,
  "stars": [2, 3]
}
