{
  "v": 2,
  "id": "c-18",
  "title": {
    "ru": "Тихая заводь",
    "en": "Still water"
  },
  "world": 2,
  "rows": 5,
  "cols": 5,
  "targets": [[2, 2]],
  "fences": [
    [
      [1, 2],
      [1, 3]
    ],
    [
      [2, 2],
      [2, 3]
    ]
  ],
  "probeMode": "distance",
  "moveLimit": 6,
  "stars": [3, 4]
}
