{
  "v": 2,
  "id": "c-19",
  "title": {
    "ru": "Маяк у забора",
    "en": "Beacon by the fence"
  },
  "world": 2,
  "rows": 5,
  "cols": 5,
  "targets": [[2, 1]],
  "fences": [
    [
      [0, 2],
      [0, 3]
    ],
    [
      [1, 2],
      [1, 3]
    ],
    [
      [2, 2],
      [2, 3]
    ],
    [
      [3, 2],
      [3, 3]
    ]
  ],
  "beacons": [[0, 0]],
  "probeMode": "distance",
  "moveLimit": 4,
  "stars": [2, 3]
}
