{
  "v": 2,
  "id": "c-17",
  "title": {
    "ru": "Зигзаг",
    "en": "Zigzag"
  },
  "world": 2,
  "rows": 6,
  "cols": 6,
  "targets": [[1, 3]],
  "fences": [
    [
      [1, 1],
      [1, 2]
    ],
    [
      [2, 1],
      [2, 2]
    ],
    [
      [3, 1],
      [3, 2]
    ],
    [
      [4, 1],
      [4, 2]
    ],
    [
      [5, 1],
      [5, 2]
    ],
    [
      [0, 3],
      [0, 4]
    ],
    [
      [1, 3],
      [1, 4]
    ],
    [
      [2, 3],
      [2, 4]
    ],
    [
      [3, 3],
      [3, 4]
    ],
    [
      [4, 3],
      [4, 4]
    ]
  ],
  "probeMode": "distance",
  "moveLimit": 5,
  "stars": [3, 4]
}
